{
  "$schema": "https://json-schema.org/draft/2020-12/schema",
  "$id": "https://github.com/open-asi-governance/open-asi-governance-forum/tools/schemas/qualification.schema.json",
  "title": "OAGRC qualification record — a gate on an instrument, not a ballot",
  "description": "The result of a counterfactual qualification round. It ballots no proposition, adopts nothing, and confers no status on any text in it; it can only disqualify the ratification instrument that would have followed. A pass establishes ONLY that the sampled invocations distinguished the actual constraints from matched authority-expanding variants. CLOSED and structurally strict: the first version allowed arbitrary extra fields and barely validated nested content, so a one-party result listing five sources validated cleanly. Cross-field consistency that JSON Schema cannot express -- qualified implying no failed party, sources agreeing with per_party -- is checked in validate_provenance.py.",
  "type": "object",
  "additionalProperties": false,
  "required": [
    "schema_version",
    "artifact_type",
    "cohort",
    "prompt_sha256",
    "expected_parties",
    "k_by_party",
    "answer_key",
    "registered_direction",
    "displayed_texts",
    "per_party",
    "state",
    "qualified",
    "consequence",
    "what_a_pass_establishes",
    "sources"
  ],
  "properties": {
    "schema_version": {
      "type": "string"
    },
    "artifact_type": {
      "const": "qualification_record"
    },
    "cohort": {
      "type": "string"
    },
    "prompt_sha256": {
      "type": "string",
      "pattern": "^[0-9a-f]{64}$",
      "description": "The instrument's identity. 'No retry' is enforced on this, not on the cohort name, so a fresh cohort cannot launder a second attempt."
    },
    "answer_key": {
      "type": "object",
      "minProperties": 1
    },
    "registered_direction": {
      "type": "object",
      "minProperties": 1
    },
    "displayed_texts": {
      "type": "object",
      "minProperties": 1
    },
    "per_party": {
      "type": "object",
      "minProperties": 1,
      "additionalProperties": {
        "type": "object",
        "required": [
          "passed",
          "k_collected",
          "k_registered",
          "problems",
          "verdict"
        ],
        "properties": {
          "passed": {
            "type": "boolean"
          },
          "k_collected": {
            "type": "integer",
            "minimum": 0
          },
          "k_registered": {
            "type": "integer",
            "minimum": 1
          },
          "problems": {
            "type": "array",
            "items": {
              "type": "string"
            }
          },
          "verdict": {
            "type": "string"
          },
          "per_clause": {
            "type": "object"
          }
        }
      }
    },
    "parties_that_errored": {
      "type": "array",
      "items": {
        "type": "string"
      }
    },
    "qualified": {
      "type": "boolean"
    },
    "consequence": {
      "type": "string"
    },
    "what_a_pass_establishes": {
      "type": "string"
    },
    "sources": {
      "type": "array",
      "minItems": 1,
      "items": {
        "type": "object",
        "required": [
          "path",
          "sha256"
        ],
        "properties": {
          "path": {
            "type": "string"
          },
          "sha256": {
            "type": "string",
            "pattern": "^[0-9a-f]{64}$"
          }
        }
      },
      "description": "EVERY raw sample file the result was computed from, like a finding_coding and not a single source: a record describing five parties that anchored only the first could drift from four of them unnoticed."
    },
    "expected_parties": {
      "type": "array",
      "minItems": 1,
      "items": {
        "type": "string"
      },
      "description": "The FIXED cohort. Scoring covers all of these regardless of which arm a given invocation collected; a partial cohort can never qualify."
    },
    "k_by_party": {
      "type": "object",
      "minProperties": 1,
      "additionalProperties": {
        "type": "integer",
        "minimum": 1
      },
      "description": "Exact registered sample count per party, read from the committed spec."
    },
    "state": {
      "type": "string",
      "enum": [
        "QUALIFIED",
        "PENDING",
        "HALT"
      ],
      "description": "PENDING exists because a local-arm pass is not a qualification."
    },
    "shape_note": {
      "type": "string",
      "description": "Present only on an artifact whose SHAPE was migrated to a later schema version. It must say what was and was not re-derived: a migrated record that silently rescored itself under current constants would be indistinguishable from one that preserved its original verdict."
    }
  }
}
